question,answer,contexts,answer_relevancy
Was Zeichnet Bartenwale aus?," Bartenwale, auch bekannt als Mysticeti, sind in der Lage, Plankton, kleine Fische und Krustentiere aus dem Wasser zu sieben. Sie haben beeindruckende Barten, ein System von plattenförmigen Filtern in ihrem Mund, die ihnen helfen, ihre Nahrung aus dem Wasser zu filtrieren.","['file_path: C:\\Users\\Reakt\\Desktop\\EnterpriseSearch\\rag-mvp\\enterprise-search-app\\backend\\data\\wale.txt\n\nWale gehören zu den faszinierendsten und majestätischsten Kreaturen der Ozeane. Diese Säugetiere, die sich vor Millionen von Jahren aus landbewohnenden Vorfahren zu vollständig im Wasser lebenden Wesen entwickelt haben, spielen eine entscheidende Rolle in maritimen Ökosystemen. Es gibt eine beeindruckende Vielfalt an Walarten, die sich in Größe, Ernährung und Verhalten deutlich unterscheiden. Von den gigantischen Blauwalen, die als die größten Tiere gelten, die jemals auf der Erde gelebt haben, bis hin zu den geselligen und akrobatischen Buckelwalen, bietet die Welt der Wale eine schier unendliche Quelle der Bewunderung und wissenschaftlichen Forschung.\n\nKlassifikation und Arten\nWale werden grob in zwei Hauptgruppen unterteilt: Bartenwale (Mysticeti) und Zahnwale (Odontoceti). Bartenwale sind bekannt für ihre beeindruckenden Barten, ein System von plattenförmigen Filtern in ihrem Mund, mit denen sie Plankton, kleine Fische und Krustentiere aus dem Wasser sieben. Zu dieser Gruppe gehören einige der größten Wale, wie der bereits erwähnte Blauwal, der Grauwal und der Buckelwal. Zahnwale hingegen verfügen über Zähne und jagen größere Beute, einschließlich Fische und Tintenfische. Diese Gruppe umfasst Arten wie den Pottwal, den Orca (auch als Killerwal bekannt) und den Belugawal.\n\nAnpassungen an das Leben im Wasser\nDie Evolution hat Wale perfekt an das Leben im Wasser angepasst. Ihre Körper sind stromlinienförmig, um den Widerstand beim Schwimmen zu minimieren, und sie haben kraftvolle Schwanzflossen, die vertikal bewegt werden, um Antrieb zu erzeugen.'
 'file_path: C:\\Users\\Reakt\\Desktop\\EnterpriseSearch\\rag-mvp\\enterprise-search-app\\backend\\data\\dakota.txt\n\nSouth Dakota, bekannt für seine vielfältige Landschaft, die von weiten Ebenen bis zu zerklüfteten Bergen reicht, ist ein Bundesstaat, der sowohl in kultureller als auch in natürlicher Hinsicht viel zu bieten hat. Die Hauptstadt, Pierre, liegt zentral in South Dakota und dient als politisches und administratives Zentrum des Bundesstaates. Trotz ihrer relativ geringen Einwohnerzahl spielt Pierre eine wichtige Rolle in der Geschichte und Politik South Dakotas. Umgeben von der malerischen Landschaft des Missouri-Flusses, bietet diese Stadt eine einzigartige Kombination aus natürlicher Schönheit, historischen Sehenswürdigkeiten und kulturellen Einrichtungen, die sie zu einem interessanten Ziel für Besucher und Einheimische gleichermaßen macht.'
 'file_path: C:\\Users\\Reakt\\Desktop\\EnterpriseSearch\\rag-mvp\\enterprise-search-app\\backend\\data\\flugzeuge.txt\n\nIn der stahlblauen Unendlichkeit des Himmels, wo Wolken wie zarte Wattebäusche treiben, entfaltet sich die majestätische Welt der Flugzeuge. Diese Wunderwerke der Technik, geboren aus der unermüdlichen Sehnsucht des Menschen, die Fesseln der Erde zu durchbrechen und sich den Vögeln gleich in die Lüfte zu schwingen, erzählen Geschichten von Abenteuer, Entdeckung und der unerschütterlichen Kraft des menschlichen Geistes.\n\nEin Flugzeug ist mehr als nur ein Gefährt; es ist ein Zeugnis menschlicher Ingenieurskunst, das die Grenzen dessen, was möglich ist, stetig neu definiert. Mit schlanken Flügeln, die sich elegant gegen den Widerstand der Luft stemmen, und Triebwerken, die mit donnerndem Getöse die Stille des Himmels durchbrechen, verkörpern sie den ewigen Traum vom Fliegen.\n\nJedes Mal, wenn ein Flugzeug die Piste verlässt und sich dem Himmel entgegenstreckt, wird ein kleines Wunder vollbracht. Es ist ein Moment des Aufbruchs, ein Versprechen auf neue Horizonte. Unter ihm breiten sich Landschaften aus, die in ihrer ruhigen Schönheit dahingleiten, von den mächtigen Ozeanen, die in der Sonne glitzern, bis zu den unendlichen Wüsten, deren Sand im Wind flüstert. Und über allem wacht das Flugzeug, ein silberner Pfeil, der die Weiten des Himmels durchmisst.\n\nDie Kabine, ein schwebendes Mikrokosmos, birgt in sich eine Welt voll flüchtiger Begegnungen und stiller Momente der Reflexion. Hier, hoch über den Wolken, verschwimmen die Grenzen zwischen Zeit und Raum.']",0.9095509891101073
Was zeichnet Zahnwale aus?," Zahnwale sind bekannt für ihre Zähne, die sie verwenden, um größere Beute wie Fische und Tintenfische zu jagen. Sie werden auch als Odontoceti bezeichnet und unterscheiden sich von Bartenwalen durch ihr Fehlen von Barten im Mund.","['file_path: C:\\Users\\Reakt\\Desktop\\EnterpriseSearch\\rag-mvp\\enterprise-search-app\\backend\\data\\wale.txt\n\nWale gehören zu den faszinierendsten und majestätischsten Kreaturen der Ozeane. Diese Säugetiere, die sich vor Millionen von Jahren aus landbewohnenden Vorfahren zu vollständig im Wasser lebenden Wesen entwickelt haben, spielen eine entscheidende Rolle in maritimen Ökosystemen. Es gibt eine beeindruckende Vielfalt an Walarten, die sich in Größe, Ernährung und Verhalten deutlich unterscheiden. Von den gigantischen Blauwalen, die als die größten Tiere gelten, die jemals auf der Erde gelebt haben, bis hin zu den geselligen und akrobatischen Buckelwalen, bietet die Welt der Wale eine schier unendliche Quelle der Bewunderung und wissenschaftlichen Forschung.\n\nKlassifikation und Arten\nWale werden grob in zwei Hauptgruppen unterteilt: Bartenwale (Mysticeti) und Zahnwale (Odontoceti). Bartenwale sind bekannt für ihre beeindruckenden Barten, ein System von plattenförmigen Filtern in ihrem Mund, mit denen sie Plankton, kleine Fische und Krustentiere aus dem Wasser sieben. Zu dieser Gruppe gehören einige der größten Wale, wie der bereits erwähnte Blauwal, der Grauwal und der Buckelwal. Zahnwale hingegen verfügen über Zähne und jagen größere Beute, einschließlich Fische und Tintenfische. Diese Gruppe umfasst Arten wie den Pottwal, den Orca (auch als Killerwal bekannt) und den Belugawal.\n\nAnpassungen an das Leben im Wasser\nDie Evolution hat Wale perfekt an das Leben im Wasser angepasst. Ihre Körper sind stromlinienförmig, um den Widerstand beim Schwimmen zu minimieren, und sie haben kraftvolle Schwanzflossen, die vertikal bewegt werden, um Antrieb zu erzeugen.'
 'file_path: C:\\Users\\Reakt\\Desktop\\EnterpriseSearch\\rag-mvp\\enterprise-search-app\\backend\\data\\flugzeuge.txt\n\nIn ihrem endlosen Tanz am Himmel verkörpern sie die Träume und Hoffnungen von Generationen, ein leuchtendes Symbol für die Kraft der Vorstellung und die Unendlichkeit menschlicher Ambitionen.'
 'file_path: C:\\Users\\Reakt\\Desktop\\EnterpriseSearch\\rag-mvp\\enterprise-search-app\\backend\\data\\fnjvklfjvjkf.txt\n\nÜber die FNJVklfjvjkf-Company\r\nDie FNJVklfjvjkf-Company, gegründet im Jahr 2005, hat sich rasch zu einem der führenden Innovatoren in der Technologiebranche entwickelt. Mit Hauptsitz in Berlin, Deutschland, beschäftigt das Unternehmen über 5.000 Mitarbeiter weltweit und betreibt Niederlassungen in mehr als 20 Ländern. Bekannt für ihre fortschrittlichen Lösungen in der künstlichen Intelligenz, Datenanalyse und nachhaltigen Energie, hat die FNJVklfjvjkf-Company sich einen Namen gemacht, der mit Innovation und Qualität synonym ist.\r\n\r\nGeschäftsentwicklung und Finanzleistung 2019\r\nDas Jahr 2019 war für die FNJVklfjvjkf-Company ein Jahr des außerordentlichen Wachstums und der Expansion. Mit der Einführung mehrerer bahnbrechender Produkte und der Erweiterung in neue Märkte konnte das Unternehmen seine Marktposition signifikant stärken und seine Umsatzzahlen erheblich verbessern.\r\n\r\nUmsatzsteigerung\r\nIm Jahr 2019 erzielte die FNJVklfjvjkf-Company einen beeindruckenden Jahresumsatz von 4,7 Milliarden Euro, was einem Wachstum von 12% im Vergleich zum Vorjahr entspricht. Dieser Erfolg spiegelt die effektive Implementierung unserer Strategien für Produktinnovation und Marktexpansion wider sowie unsere Anpassungsfähigkeit in einem dynamisch verändernden technologischen Umfeld.\r\n\r\nStrategische Initiativen\r\nDie FNJVklfjvjkf-Company hat 2019 mehrere strategische Initiativen umgesetzt, die zentral für die Umsatzsteigerung waren. Dazu gehörten:\r\n\r\nMarkteinführung neuer Produkte: Einführung von drei neuen KI-basierten Produkten, die darauf abzielen, die Effizienz in den Bereichen erneuerbare Energien und Smart City-Lösungen zu erhöhen.']",0.8793296828151057
Was war der Umsatz der FNJVklfjvjkf-Company im Jahr 2019?," Im Jahr 2019 erzielte die FNJVklfjvjkf-Company einen beeindruckenden Jahresumsatz von 4,7 Milliarden Euro.","['file_path: C:\\Users\\Reakt\\Desktop\\EnterpriseSearch\\rag-mvp\\enterprise-search-app\\backend\\data\\fnjvklfjvjkf.txt\n\nÜber die FNJVklfjvjkf-Company\r\nDie FNJVklfjvjkf-Company, gegründet im Jahr 2005, hat sich rasch zu einem der führenden Innovatoren in der Technologiebranche entwickelt. Mit Hauptsitz in Berlin, Deutschland, beschäftigt das Unternehmen über 5.000 Mitarbeiter weltweit und betreibt Niederlassungen in mehr als 20 Ländern. Bekannt für ihre fortschrittlichen Lösungen in der künstlichen Intelligenz, Datenanalyse und nachhaltigen Energie, hat die FNJVklfjvjkf-Company sich einen Namen gemacht, der mit Innovation und Qualität synonym ist.\r\n\r\nGeschäftsentwicklung und Finanzleistung 2019\r\nDas Jahr 2019 war für die FNJVklfjvjkf-Company ein Jahr des außerordentlichen Wachstums und der Expansion. Mit der Einführung mehrerer bahnbrechender Produkte und der Erweiterung in neue Märkte konnte das Unternehmen seine Marktposition signifikant stärken und seine Umsatzzahlen erheblich verbessern.\r\n\r\nUmsatzsteigerung\r\nIm Jahr 2019 erzielte die FNJVklfjvjkf-Company einen beeindruckenden Jahresumsatz von 4,7 Milliarden Euro, was einem Wachstum von 12% im Vergleich zum Vorjahr entspricht. Dieser Erfolg spiegelt die effektive Implementierung unserer Strategien für Produktinnovation und Marktexpansion wider sowie unsere Anpassungsfähigkeit in einem dynamisch verändernden technologischen Umfeld.\r\n\r\nStrategische Initiativen\r\nDie FNJVklfjvjkf-Company hat 2019 mehrere strategische Initiativen umgesetzt, die zentral für die Umsatzsteigerung waren. Dazu gehörten:\r\n\r\nMarkteinführung neuer Produkte: Einführung von drei neuen KI-basierten Produkten, die darauf abzielen, die Effizienz in den Bereichen erneuerbare Energien und Smart City-Lösungen zu erhöhen.'
 'file_path: C:\\Users\\Reakt\\Desktop\\EnterpriseSearch\\rag-mvp\\enterprise-search-app\\backend\\data\\flugzeuge.txt\n\nIn ihrem endlosen Tanz am Himmel verkörpern sie die Träume und Hoffnungen von Generationen, ein leuchtendes Symbol für die Kraft der Vorstellung und die Unendlichkeit menschlicher Ambitionen.'
 'file_path: C:\\Users\\Reakt\\Desktop\\EnterpriseSearch\\rag-mvp\\enterprise-search-app\\backend\\data\\fnjvklfjvjkf.txt\n\nExpansion in asiatische Märkte: Eröffnung von zwei neuen Büros in Asien, um die Präsenz in schnell wachsenden Märkten zu verstärken.\r\nInvestition in Forschung und Entwicklung: Erhöhung der Investitionen in F&E um 15%, um die Entwicklung fortschrittlicher Technologien zu fördern und einen Wettbewerbsvorteil zu sichern.\r\nAusblick und Zukunftspläne\r\nFür die kommenden Jahre plant die FNJVklfjvjkf-Company, ihre Investitionen in innovative Technologien weiter zu erhöhen und ihre internationale Präsenz auszubauen. Mit einem starken Fokus auf nachhaltige Lösungen und einer Verpflichtung zur sozialen Verantwortung strebt das Unternehmen danach, seinen Beitrag zur globalen Wirtschaft und Umwelt positiv zu gestalten.\r\n\r\nDurch die konsequente Verfolgung unserer Unternehmensziele und die kontinuierliche Verbesserung unserer Produkte und Dienstleistungen ist die FNJVklfjvjkf-Company gut positioniert, um auch in Zukunft führend in der Technologiebranche zu sein. Mit einem soliden finanziellen Fundament und einer Strategie, die Innovation fördert, sehen wir einer erfolgreichen Zukunft entgegen.']",0.9825250584671475
Welche neuen Produkte hat die FNJVklfjvjkf-Company eingeführt?," Die FNJVklfjvjkf-Company hat im Jahr 2019 drei neue KI-basierte Produkte eingeführt, die darauf abzielen, die Effizienz in den Bereichen erneuerbare Energien und Smart City-Lösungen zu erhöhen.","['file_path: C:\\Users\\Reakt\\Desktop\\EnterpriseSearch\\rag-mvp\\enterprise-search-app\\backend\\data\\fnjvklfjvjkf.txt\n\nÜber die FNJVklfjvjkf-Company\r\nDie FNJVklfjvjkf-Company, gegründet im Jahr 2005, hat sich rasch zu einem der führenden Innovatoren in der Technologiebranche entwickelt. Mit Hauptsitz in Berlin, Deutschland, beschäftigt das Unternehmen über 5.000 Mitarbeiter weltweit und betreibt Niederlassungen in mehr als 20 Ländern. Bekannt für ihre fortschrittlichen Lösungen in der künstlichen Intelligenz, Datenanalyse und nachhaltigen Energie, hat die FNJVklfjvjkf-Company sich einen Namen gemacht, der mit Innovation und Qualität synonym ist.\r\n\r\nGeschäftsentwicklung und Finanzleistung 2019\r\nDas Jahr 2019 war für die FNJVklfjvjkf-Company ein Jahr des außerordentlichen Wachstums und der Expansion. Mit der Einführung mehrerer bahnbrechender Produkte und der Erweiterung in neue Märkte konnte das Unternehmen seine Marktposition signifikant stärken und seine Umsatzzahlen erheblich verbessern.\r\n\r\nUmsatzsteigerung\r\nIm Jahr 2019 erzielte die FNJVklfjvjkf-Company einen beeindruckenden Jahresumsatz von 4,7 Milliarden Euro, was einem Wachstum von 12% im Vergleich zum Vorjahr entspricht. Dieser Erfolg spiegelt die effektive Implementierung unserer Strategien für Produktinnovation und Marktexpansion wider sowie unsere Anpassungsfähigkeit in einem dynamisch verändernden technologischen Umfeld.\r\n\r\nStrategische Initiativen\r\nDie FNJVklfjvjkf-Company hat 2019 mehrere strategische Initiativen umgesetzt, die zentral für die Umsatzsteigerung waren. Dazu gehörten:\r\n\r\nMarkteinführung neuer Produkte: Einführung von drei neuen KI-basierten Produkten, die darauf abzielen, die Effizienz in den Bereichen erneuerbare Energien und Smart City-Lösungen zu erhöhen.'
 'file_path: C:\\Users\\Reakt\\Desktop\\EnterpriseSearch\\rag-mvp\\enterprise-search-app\\backend\\data\\fnjvklfjvjkf.txt\n\nExpansion in asiatische Märkte: Eröffnung von zwei neuen Büros in Asien, um die Präsenz in schnell wachsenden Märkten zu verstärken.\r\nInvestition in Forschung und Entwicklung: Erhöhung der Investitionen in F&E um 15%, um die Entwicklung fortschrittlicher Technologien zu fördern und einen Wettbewerbsvorteil zu sichern.\r\nAusblick und Zukunftspläne\r\nFür die kommenden Jahre plant die FNJVklfjvjkf-Company, ihre Investitionen in innovative Technologien weiter zu erhöhen und ihre internationale Präsenz auszubauen. Mit einem starken Fokus auf nachhaltige Lösungen und einer Verpflichtung zur sozialen Verantwortung strebt das Unternehmen danach, seinen Beitrag zur globalen Wirtschaft und Umwelt positiv zu gestalten.\r\n\r\nDurch die konsequente Verfolgung unserer Unternehmensziele und die kontinuierliche Verbesserung unserer Produkte und Dienstleistungen ist die FNJVklfjvjkf-Company gut positioniert, um auch in Zukunft führend in der Technologiebranche zu sein. Mit einem soliden finanziellen Fundament und einer Strategie, die Innovation fördert, sehen wir einer erfolgreichen Zukunft entgegen.'
 'file_path: C:\\Users\\Reakt\\Desktop\\EnterpriseSearch\\rag-mvp\\enterprise-search-app\\backend\\data\\wale.txt\n\nSolche kulturellen Übertragungen sind ein Beweis für die hohe Intelligenz und Anpassungsfähigkeit von Walen.\n\nBedrohungen und Schutz\nTrotz ihrer Größe und Stärke sind Wale heute vielen Bedrohungen ausgesetzt. Der kommerzielle Walfang hat im 20. Jahrhundert zu einem drastischen Rückgang der Walpopulationen geführt, und obwohl viele Arten jetzt unter internationalen Schutz gestellt sind, erholen sich einige Populationen nur langsam. Zusätzlich zu direkten Bedrohungen durch den Menschen sind Wale auch indirekten Gefahren ausgesetzt, wie']",0.8698219048356411
Wie hat FNJVklfjvjkf-Company in asiatischen Ländern expandiert?," Die FNJVklfjvjkf-Company hat 2019 Expansion in asiatische Märkte umgesetzt, indem zwei neue Büros in Asien eröffnet wurden, um die Präsenz in schnell wachsenden Märkten zu verstärken.","['file_path: C:\\Users\\Reakt\\Desktop\\EnterpriseSearch\\rag-mvp\\enterprise-search-app\\backend\\data\\fnjvklfjvjkf.txt\n\nÜber die FNJVklfjvjkf-Company\r\nDie FNJVklfjvjkf-Company, gegründet im Jahr 2005, hat sich rasch zu einem der führenden Innovatoren in der Technologiebranche entwickelt. Mit Hauptsitz in Berlin, Deutschland, beschäftigt das Unternehmen über 5.000 Mitarbeiter weltweit und betreibt Niederlassungen in mehr als 20 Ländern. Bekannt für ihre fortschrittlichen Lösungen in der künstlichen Intelligenz, Datenanalyse und nachhaltigen Energie, hat die FNJVklfjvjkf-Company sich einen Namen gemacht, der mit Innovation und Qualität synonym ist.\r\n\r\nGeschäftsentwicklung und Finanzleistung 2019\r\nDas Jahr 2019 war für die FNJVklfjvjkf-Company ein Jahr des außerordentlichen Wachstums und der Expansion. Mit der Einführung mehrerer bahnbrechender Produkte und der Erweiterung in neue Märkte konnte das Unternehmen seine Marktposition signifikant stärken und seine Umsatzzahlen erheblich verbessern.\r\n\r\nUmsatzsteigerung\r\nIm Jahr 2019 erzielte die FNJVklfjvjkf-Company einen beeindruckenden Jahresumsatz von 4,7 Milliarden Euro, was einem Wachstum von 12% im Vergleich zum Vorjahr entspricht. Dieser Erfolg spiegelt die effektive Implementierung unserer Strategien für Produktinnovation und Marktexpansion wider sowie unsere Anpassungsfähigkeit in einem dynamisch verändernden technologischen Umfeld.\r\n\r\nStrategische Initiativen\r\nDie FNJVklfjvjkf-Company hat 2019 mehrere strategische Initiativen umgesetzt, die zentral für die Umsatzsteigerung waren. Dazu gehörten:\r\n\r\nMarkteinführung neuer Produkte: Einführung von drei neuen KI-basierten Produkten, die darauf abzielen, die Effizienz in den Bereichen erneuerbare Energien und Smart City-Lösungen zu erhöhen.'
 'file_path: C:\\Users\\Reakt\\Desktop\\EnterpriseSearch\\rag-mvp\\enterprise-search-app\\backend\\data\\fnjvklfjvjkf.txt\n\nExpansion in asiatische Märkte: Eröffnung von zwei neuen Büros in Asien, um die Präsenz in schnell wachsenden Märkten zu verstärken.\r\nInvestition in Forschung und Entwicklung: Erhöhung der Investitionen in F&E um 15%, um die Entwicklung fortschrittlicher Technologien zu fördern und einen Wettbewerbsvorteil zu sichern.\r\nAusblick und Zukunftspläne\r\nFür die kommenden Jahre plant die FNJVklfjvjkf-Company, ihre Investitionen in innovative Technologien weiter zu erhöhen und ihre internationale Präsenz auszubauen. Mit einem starken Fokus auf nachhaltige Lösungen und einer Verpflichtung zur sozialen Verantwortung strebt das Unternehmen danach, seinen Beitrag zur globalen Wirtschaft und Umwelt positiv zu gestalten.\r\n\r\nDurch die konsequente Verfolgung unserer Unternehmensziele und die kontinuierliche Verbesserung unserer Produkte und Dienstleistungen ist die FNJVklfjvjkf-Company gut positioniert, um auch in Zukunft führend in der Technologiebranche zu sein. Mit einem soliden finanziellen Fundament und einer Strategie, die Innovation fördert, sehen wir einer erfolgreichen Zukunft entgegen.'
 'file_path: C:\\Users\\Reakt\\Desktop\\EnterpriseSearch\\rag-mvp\\enterprise-search-app\\backend\\data\\flugzeuge.txt\n\nIn ihrem endlosen Tanz am Himmel verkörpern sie die Träume und Hoffnungen von Generationen, ein leuchtendes Symbol für die Kraft der Vorstellung und die Unendlichkeit menschlicher Ambitionen.']",0.8620526800042926
